{"schema":"geometry.step_topology.restore.result.a0","session":{"session_handle":"gts_2222222222222222222222222222222222222222222222222222222222222222","generation":1},"source":{"format":"step","sha256":"7fa646430db55036b9b854b32c2f8d6f37fd929bf6c74fa31b55d33605719cb4","bytes":15,"normalized_length_unit":"millimeter"},"tool":{"name":"geometer","release_version":"2026.8.21","occt_version":"8.0.1"},"replayed_transaction_count":1,"recovery":[],"diagnostics":[]}
