{"schema":"geometry.step_topology.restore.result.a0","session":{"session_handle":"gts_2222222222222222222222222222222222222222222222222222222222222222","generation":1},"source":{"format":"step","sha256":"7fa646430db55036b9b854b32c2f8d6f37fd929bf6c74fa31b55d33605719cb4","bytes":15,"normalized_length_unit":"millimeter"},"tool":{"name":"geometer","release_version":"2026.9.3","occt_version":"8.0.1"},"replayed_transaction_count":1,"recovery":[{"group_authored_id":"wn.geometer.research.group.two-faces","provenance":{"source_artifact_sha256":"aaaaaaaaaaaaaaaaaaaaaaaaaaaaaaaaaaaaaaaaaaaaaaaaaaaaaaaaaaaaaaaa","candidate_artifact_sha256":"bbbbbbbbbbbbbbbbbbbbbbbbbbbbbbbbbbbbbbbbbbbbbbbbbbbbbbbbbbbbbbbb","source_occt_version":"8.0.1","candidate_occt_version":"8.0.1","source_driver":"STEPCAFControl_Reader","candidate_driver":"STEPCAFControl_Reader","source_writer_settings":"AP242DIS;metadata=true","candidate_writer_settings":"AP242DIS;metadata=true","command_provenance":"geometer research fixture","measured_wall_time_milliseconds":12.5},"resolution_state":"resolved","completeness":"fully_recovered","resolved_member_count":2,"ambiguous_member_count":0,"unresolved_member_count":0,"unsupported_member_count":0,"members":[{"member_record_id":"wn.geometer.research.member.face-a","kind":"face","authored_target_id":"wn.geometer.research.target.face-a","resolution_state":"resolved","resolution_method":"authored_id_topology_link","topology_comparison":"unchanged","confidence":"high","resolved_target_handle":"gtt_3333333333333333333333333333333333333333333333333333333333333333","evidence":{"candidate_count":1,"matching_candidate_count":1,"compared_fields":[{"value":"authored_target_id"}],"tolerances":{"length_mm":0.000001,"area_mm2":0.000001,"volume_mm3":0.000001},"carrier_records":[{"value":"GISU #654"}],"rejected_alternatives":[]}}]}],"diagnostics":[]}